ticket_id,subject,description
1001,"Moodle Login","I keep getting a 403 Forbidden error when trying to access the course page."
1002,"Tuition Payment","Has my wire transfer from Monday cleared yet? I have a hold on my account."
1003,"Broken Window","There is a draft coming from the window in Room 304, handle is stuck."
1004,"Transcript Request","I need an official transcript sent to the Fulbright commission by Friday."
1005,"Wifi Library","The Eduroam connection drops every 5 minutes on the 2nd floor."
1006,"Payroll Tax","My tax withholding seems wrong on this month's slip."
